topic,link,domain,published_date,title,lang
TECHNOLOGY,https://www.zmescience.com/science/news-science/information-fifth-state-matter-0252/,zmescience.com,2020-08-11 16:52:24,"Physicists claim information is the fifth state of matter. By 2245, half of Earth’s mass could be converted to digital bits",en
SPORTS,https://www.liverpool.com/liverpool-fc-news/liverpool-fsg-sponsor-premier-league-18743907,liverpool.com,2020-08-10 11:00:00,"Liverpool lack in important money-making area, and big Anfield change will help bridge gap",en
BUSINESS,https://galusaustralis.com/2020/08/819688/global-cleaning-robot-market-2020-competitive-analysis-irobot-us-alfred-karcher-germany-samsung-south-korea/,galusaustralis.com,2020-08-11 02:57:49,"Global Cleaning Robot Market 2020 Competitive Analysis – iRobot (US, Alfred Kärcher (Germany), Samsung (South Korea)",en
SPORTS,https://www.reuters.com/article/us-golf-pgachamp-curry/curry-hails-return-of-sports-idUSKCN25601M,reuters.com,2020-08-10 00:45:00,Curry hails return of sports,en
SPORTS,https://www.usatoday.com/story/sports/nhl/2020/08/10/nhl-draft-lottery-alexis-lafreniere/3330653001/,usatoday.com,2020-08-10 10:28:15,NHL draft lottery: Ranking the eight teams 1-8 in terms of who is least deserving of No. 1 pick,en
NATION,https://www.timesofisrael.com/idf-strikes-hamas-site-in-gaza-after-arson-balloons-spark-fires-in-south/,timesofisrael.com,2020-08-06 20:46:00,IDF strikes Hamas site in Gaza after arson balloons spark fires in south,en
BUSINESS,https://ewn.co.za/2020/08/12/s-africa-s-economic-woes-bigger-than-monetary-policy-cenbank-governor,ewn.co.za,2020-08-12 15:22:46,Kganyago: SA's economic woes bigger than monetary policy,en
ENTERTAINMENT,https://www.cnn.com/2020/08/05/africa/nigerian-grandma-beyonce-intl/index.html,cnn.com,2020-08-05 14:23:00,How a grandmother from Nigeria ended up in Beyoncé's 'Black Is King',en
HEALTH,https://week.com/2020/08/07/state-places-tazewell-county-on-covid-19-warning-list/,week.com,2020-08-07 18:00:24,State places Tazewell County on COVID-19 warning list,en
HEALTH,https://www.orissapost.com/whopping-6-of-england-already-infected-with-covid-19-report/,orissapost.com,2020-08-14 08:10:00,Whopping 6% of England already infected with COVID-19: Report,en
TECHNOLOGY,https://www.gamblingnews.com/news/exciting-new-skins-coming-to-fortnite-and-leak-on-next-gen-console-release-date/,gamblingnews.com,2020-08-16 18:08:00,Next-Gen Console Release Comes with New Skins for Fortnite,en
SCIENCE,https://techtoday19.com/uk/dog-process-speech-in-the-same-way-as-human-brains-do-study-finds/,techtoday19.com,2020-08-03 21:20:27,"Dog process speech in the same way as human brains do, study finds",en
ENTERTAINMENT,http://tc01.tellychakkar.com:8080/movie/movie-news/sushant-death-probe-these-four-videos-reveal-the-truth-about-sushant-singh-rajput,tc01.tellychakkar.com:8080,2020-08-14 16:41:15,Sushant death probe: These four videos reveal the truth about Sushant Singh Rajput,en
ENTERTAINMENT,https://www.theguardian.com/tv-and-radio/2020/aug/11/its-dangerous-not-to-see-race-is-colour-blind-casting-all-its-cracked-up-to-be,theguardian.com,2020-08-11 08:00:00,'It's dangerous not to see race': is colour-blind casting all it's cracked up to be?,en
HEALTH,https://www.thecragandcanyon.ca/news/local-news/covid-19-update-for-aug-17-heres-the-latest-on-coronavirus-in-b-c/wcm/ff70ab8d-2ea6-49ca-b9b8-ba53d9e8a1b9?video_autoplay=true,thecragandcanyon.ca,2020-08-17 15:59:50,COVID-19 update for Aug. 17: Here's the latest on coronavirus in B.C.,en
TECHNOLOGY,https://www.nag.co.za/2020/08/05/super-smash-bros-ultimate-gets-surprise-update/,nag.co.za,2020-08-05 12:00:00,Super Smash Bros. Ultimate gets surprise update > NAG,en
SPORTS,https://www.atptour.com/en/news/djokovic-federer-montreal-2007-flashback,atptour.com,2020-08-11 13:39:29,Magnificent In Montreal: Novak Djokovic's First Win Against Roger Federer,en
TECHNOLOGY,https://twinfinite.net/2020/08/side-quests-ghost-of-tsushima/,twinfinite.net,2020-08-07 16:50:57,Ticking off Ghost of Tsushima's Map Is Incredibly Therapeutic,en
SPORTS,https://www.mirror.co.uk/sport/football/transfer-news/chelsea-kai-havertz-transfer-willian-22494902,mirror.co.uk,2020-08-10 03:04:00,Chelsea transfer roundup: Kai Havertz deal 'agreed' as Blues target Ajax duo,en
WORLD,https://www.telegraph.co.uk/news/2020/08/11/new-zealand-lockdown-auckland-local-cases-workers-stay-home/,telegraph.co.uk,2020-08-11 10:27:00,New Zealand locks down Auckland after first local cases in 100 days,en
HEALTH,https://www.theladders.com/career-advice/the-link-between-obesity-and-covid-19,theladders.com,2020-08-06 11:25:25,The link between obesity and COVID-19,en
HEALTH,https://www.medicalnewstoday.com/articles/covid-19-outbreak-at-a-kids-summer-camp-may-be-stark-warning,medicalnewstoday.com,2020-08-04 09:05:50,COVID-19 outbreak at a kids' summer camp may be stark warning,en
NATION,https://rappler.com/nation/weather/tropical-depression-gener-pagasa-forecast-august-13-2020-11am,rappler.com,2020-08-13 06:14:27,"Tropical Depression Gener enters PAR, but not a threat",en
SCIENCE,https://www.cnet.com/how-to/the-2020-perseid-meteor-shower-is-peaking-how-to-watch-the-show/,cnet.com,2020-08-12 02:28:00,The 2020 Perseid meteor shower is peaking: How to watch the show,en
BUSINESS,https://www.valdostadailytimes.com/news/business/harnessing-social-media-data-to-boost-brand-loyalty-for-a-german-auto-manufacturer-a-social/article_6ce75d9a-2848-5b0e-9545-c1ab4279d1f9.html,valdostadailytimes.com,2020-08-07 16:15:24,Harnessing Social Media Data To Boost Brand Loyalty For a German Auto Manufacturer – A Social Media Analytics Success Story,en
TECHNOLOGY,https://www.neowin.net/news/f1-2018-is-free-to-claim-on-the-humble-store/,neowin.net,2020-08-07 20:54:00,F1 2018 is free to claim on the Humble Store,en
SCIENCE,https://www.dailymail.co.uk/sciencetech/article-8600497/Healthy-blue-food-colouring-soon-brightening-dinner-plates.html,dailymail.co.uk,2020-08-06 15:00:58,'Healthy' blue food colouring could brighten up our dinner plates,en
SCIENCE,https://www.rbth.com/science-and-tech/332536-how-russian-cosmonauts-return-to-earth,rbth.com,2020-08-04 15:17:10,How Russian cosmonauts return to Earth,en
WORLD,https://ewn.co.za/2020/08/09/trump-calls-for-lebanon-to-hold-transparent-investigation-into-blast,ewn.co.za,2020-08-09 17:30:17,Trump calls for Lebanon to hold 'transparent investigation' into blast,en
WORLD,https://www.msn.com/en-us/news/us/chicago-braces-for-more-looting-after-chaotic-night/ar-BB17MXi2?li=BBnb7Kz,msn.com,2020-08-11 01:52:00,Chicago Braces for More Looting After Chaotic Night,en
TECHNOLOGY,https://techtrendske.co.ke/nokia-phone-maker-hmd-global-raises-230-million-funding-from-google-qualcomm-and-nokia/,techtrendske.co.ke,2020-08-12 11:29:00,"Nokia Phone Maker HMD Global raises $230 million funding from Google, Qualcomm and Nokia",en
SPORTS,https://www.1011now.com/2020/08/13/nebraska-leadership-reconfirming-allegiance-to-big-ten/,1011now.com,2020-08-13 13:59:00,Nebraska leadership reconfirms allegiance to Big Ten,en
TECHNOLOGY,https://www.gamespot.com/articles/rumored-batman-gotham-knights-teaser-hints-at-immi/1100-6481021/,gamespot.com,2020-08-17 19:36:00,"Rumored Batman: Gotham Knights Teaser Hints At Imminent Reveal, Possible Court Of Owls Connection",en
WORLD,https://www.washingtonpost.com/politics/trump-israel-uae-middle-east-peace/2020/08/16/e245a358-defc-11ea-8051-d5f887d73381_story.html,washingtonpost.com,2020-08-16 18:39:00,Israel-UAE deal shows how the very notion of Middle East peace has shifted under Trump,en
ENTERTAINMENT,http://www.justjared.com/2020/08/07/kristen-wiig-gets-candid-about-isolating-ivf-experience-fertility-struggles/,justjared.com,2020-08-07 14:29:34,Kristen Wiig Gets Candid About 'Isolating' IVF Experience & Fertility Struggles,en
WORLD,https://www.foxnews.com/politics/bret-baier-israel-uae-peace-middle-east,foxnews.com,2020-08-13 22:20:04,Bret Baier calls Israel-UAE peace deal a 'tectonic shift' in how 'the Middle East operates',en
TECHNOLOGY,https://www.theverge.com/21350015/google-one-backup-android-phone-how-to,theverge.com,2020-08-03 20:17:56,How to use Google One to back up your Android phone,en
WORLD,https://www.news.com.au/world/coronavirus/australia/coronavirus-australias-deputy-cmo-nick-coatsworth-says-victorian-cases-on-a-plateau/news-story/0bf956801a162146297a52d59e961c89,news.com.au,2020-08-09 12:31:20,"Coronavirus: Victorian cases ‘on a plateau’, says Dr Nick Coatsworth",en
SPORTS,https://www.manchestereveningnews.co.uk/sport/football/football-news/man-city-press-conference-live-18770171,manchestereveningnews.co.uk,2020-08-14 16:22:47,Pep Guardiola Man City press conference RECAP early team news vs Lyon in Champions League,en
NATION,https://www.thenews.com.pk/print/695770-pti-sindh-to-launch-train-march-on-august-5-on-kashmir-issue,thenews.com.pk,2020-08-04 01:00:00,PTI Sindh to launch ‘Train March on August 5 on Kashmir issue,en
WORLD,https://www.nzherald.co.nz/world/news/article.cfm?c_id=2&objectid=12354448,nzherald.co.nz,2020-08-06 19:25:14,"CCTV: UK woman's final moments before being raped, murdered by 'trusted' friend",en
HEALTH,https://www.thestar.com.my/news/world/2020/08/17/mexico039s-coronavirus-cases-rise-to-522162-deaths-to-56757,thestar.com.my,2020-08-17 00:37:00,"Mexico's coronavirus cases rise to 522162, deaths to 56757",en
WORLD,https://www.reuters.com/article/us-lebanon-security-blast-ship-insight/who-owned-the-chemicals-that-blew-up-beirut-no-one-will-say-idUSKCN2571CP,reuters.com,2020-08-11 10:21:00,Who owned the chemicals that blew up Beirut? No one will say,en
HEALTH,https://kfmradio.com/news/10082020-0954/listen-agriculture-minister-says-dept-working-revising-health-protocols-meat,kfmradio.com,2020-08-10 09:02:05,Listen: Agriculture Minister Says Dept Working On Revising Health Protocols For Meat Processing Plants.,en
NATION,https://www.theglobeandmail.com/business/article-migrant-workers-on-farms-across-canada-are-being-told-they-cant-leave/,theglobeandmail.com,2020-08-04 00:51:37,"Migrant workers on farms across Canada are being told they can’t leave, raising rights concerns",en
HEALTH,https://www.eurekalert.org/pub_releases/2020-08/aabu-sic081220.php,eurekalert.org,2020-08-12 17:03:32,Significantly improved COVID-19 outcomes in countries with higher TB vaccination coverage,en
BUSINESS,https://www.finextra.com/newsarticle/36330/google-to-offer-co-branded-accounts-with-eight-us-banks,finextra.com,2020-08-03 15:16:35,Google to offer co-branded accounts with eight US banks,en
TECHNOLOGY,https://mspoweruser.com/microsoft-reveals-cause-for-recent-google-related-edge-browser-crashes/,mspoweruser.com,2020-08-05 07:15:01,Microsoft reveals cause for recent Google-related Edge browser crashes,en
NATION,https://www.tribuneindia.com/news/punjab/punjab-chief-minister-launches-rs-92-crore-smart-connect-scheme-125748,tribuneindia.com,2020-08-13 01:38:00,Punjab Chief Minister launches Rs 92 crore Smart Connect Scheme,en
WORLD,https://www.news.com.au/world/coronavirus/global/coronavirus-us-death-toll-to-reach-300000-by-december/news-story/300e5509d1711293f166f8d4331a196a,news.com.au,2020-08-08 03:25:54,"Coronavirus US: Death toll to reach 300,000 by December",en
NATION,https://indianexpress.com/article/india/coronavirus-india-live-updates-covid-19-cases-tracker-latest-news-corona-cases-in-india-covid-19-vaccine-india-lockdown-today-news-6545324/,indianexpress.com,2020-08-09 04:41:59,"Coronavirus India LIVE Updates: 64,399 new cases, 861 deaths in India; fire at covid facility in Vijayawada hotel",en
HEALTH,https://www.theguardian.com/world/2020/aug/07/preston-added-to-areas-with-bans-on-households-mixing-due-to-covid-19,theguardian.com,2020-08-07 16:52:00,Preston added to areas with bans on households mixing due to Covid-19,en
HEALTH,https://www.theindianwire.com/health-fitness/lunar-cov19-vaccines-early-stage-human-clinical-trial-to-commence-in-singapore-282175/,theindianwire.com,2020-08-09 12:51:18,Lunar-Cov19 Vaccine's Early-stage human clinical trial to commence in Singapore,en
BUSINESS,https://www.prnewswire.com/news-releases/worldwide-paints-and-coatings-industry-insights-2020-2025---leading-players-are-akzonobel-ppg-industries-the-sherwin-williams-company-nippon-paint-holdings-co-and-axalta-coatings-systems-301108414.html,prnewswire.com,2020-08-07 20:00:00,"Worldwide Paints and Coatings Industry Insights, 2020-2025 - Leading Players are AkzoNobel, PPG Industries, The Sherwin-Williams Company, Nippon Paint Holdings Co, and Axalta Coatings Systems",en
BUSINESS,https://www.pharmiweb.com/press-release/2020-08-11/firmenich-proved-its-resilience-in-a-year-of-significant-uncertainty-1,pharmiweb.com,2020-08-11 05:23:04,Firmenich Proved its Resilience in a Year of Significant Uncertainty (1),en
SCIENCE,https://scitechdaily.com/hubble-finds-cause-for-betelgeuses-mysterious-dimming-is-aging-red-supergiant-about-to-supernova/,scitechdaily.com,2020-08-13 15:36:58,Hubble Finds Cause for Betelgeuse’s Mysterious Dimming – Is Aging Red Supergiant About to Supernova?,en
BUSINESS,https://www.investopedia.com/nvidia-nvda-a-perfect-stock-split-candidate-5074644,investopedia.com,2020-08-13 15:04:56,NVIDIA (NVDA): A Perfect Stock Split Candidate,en
HEALTH,https://thehealthmania.com/british-gps-are-not-advising-painkillers-for-chronic-pain/4209/,thehealthmania.com,2020-08-03 11:13:00,British GP’s are NOT Advising Painkillers for Chronic Pain,en
SPORTS,https://www.rte.ie/sport/soccer/2020/0811/1158587-leeds-sign-linfield-starlet-charlie-allen/,rte.ie,2020-08-11 13:19:18,Leeds sign Linfield starlet Charlie Allen,en
SPORTS,https://www.rte.ie/sport/rugby/2020/0815/1159327-former-scotland-captain-john-barclay-retires/,rte.ie,2020-08-15 09:26:50,Former Scotland captain John Barclay retires,en
HEALTH,https://www.wbay.com/2020/08/08/state-confirms-another-1165-patients-6-new-covid-19-deaths/,wbay.com,2020-08-08 19:03:00,"State confirms another 1,165 cases, 6 new COVID-19 deaths",en
HEALTH,https://filmdaily.co/health/covid-symptoms/,filmdaily.co,2020-08-06 23:15:14,What does coronavirus feel like? The list of symptoms keeps growing,en
ENTERTAINMENT,https://www.thejakartapost.com/life/2020/08/07/makeover-uk-fashion-bible-vogue-turns-serious-for-september.html,thejakartapost.com,2020-08-07 10:09:00,Makeover: UK fashion bible Vogue turns serious for September - The Jakarta Post,en
WORLD,https://www.itsinternational.com/its5/feature/its-baltic-states-rise,itsinternational.com,2020-08-11 23:37:30,ITS in the Baltic States: on the rise,en
WORLD,https://www.dailytrust.com.ng/covid-19-virus-has-not-been-detected-in-breastmilk-who.html,dailytrust.com.ng,2020-08-05 11:47:00,COVID-19 virus has not been detected in breastmilk — WHO,en
HEALTH,https://www.theguardian.com/australia-news/2020/aug/11/newmarch-house-operator-tells-of-covid-19-dysfunction-between-state-and-federal-officials,theguardian.com,2020-08-11 09:47:00,Newmarch House operator tells of Covid-19 'dysfunction' between state and federal officials,en
HEALTH,https://www.dailymail.co.uk/news/article-8596015/Britain-records-15-coronavirus-deaths-preliminary-toll.html,dailymail.co.uk,2020-08-05 13:18:30,Britain records 15 more coronavirus deaths in the preliminary toll,en
BUSINESS,https://www.marketwatch.com/story/california-plagued-by-scorching-heat-130-degrees-lightning-blackouts-and-even-fire-tornadoes-2020-08-16,marketwatch.com,2020-08-17 03:49:00,"California plagued by scorching heat (130 degrees!), lightning, blackouts and even fire tornadoes",en
ENTERTAINMENT,https://www.daijiworld.com/news/newsDisplay.aspx?newsID=740717,daijiworld.com,2020-08-14 05:45:08,Michael Jordan's rare sneakers fetch $615000 at auction,en
NATION,https://www.cbsnews.com/news/san-antonio-flea-market-shooting-today-2020-08-16/,cbsnews.com,2020-08-16 20:09:00,Multiple people injured when suspect opens fire at San Antonio flea market,en
ENTERTAINMENT,https://face2faceafrica.com/article/jussie-smolletts-sister-jurnee-says-she-was-sexually-harassed-on-every-set,face2faceafrica.com,2020-08-13 15:00:00,Jussie Smollett's sister Jurnee says she was sexually harassed on every set,en
SPORTS,https://www.usatoday.com/story/sports/golf/2020/08/06/kaymer-inspired-by-video-of-last-major-win-6-years-ago/112875118/,usatoday.com,2020-08-07 02:24:45,Kaymer inspired by video of last major win 6 years ago,en
SPORTS,https://www.cbsnews.com/news/florida-high-school-sports-will-return-this-fall-despite-thousands-of-daily-coronavirus-cases/,cbsnews.com,2020-08-15 02:56:00,"Florida high school sports approved to return this fall, despite thousands of new coronavirus cases daily",en
WORLD,https://www.nytimes.com/2020/08/07/world/americas/uribe-colombia-house-arrest.html,nytimes.com,2020-08-07 17:31:44,Álvaro Uribe’s Detention Deepens Colombia’s Divisions,en
TECHNOLOGY,https://www.digitaltveurope.com/2020/08/14/apple-reportedly-signs-deal-with-viacomcbs-to-bundle-apple-tv-showtime-and-cbs-all-access/,digitaltveurope.com,2020-08-14 10:52:07,"Apple reportedly signs deal with ViacomCBS to bundle Apple TV+, Showtime and CBS All Access",en
BUSINESS,https://www.bbc.co.uk/news/technology-53806038,bbc.co.uk,2020-08-17 14:12:01,The algorithms that make big decisions about your life,en
WORLD,https://www.theguardian.com/world/live/2020/aug/14/coronavirus-live-news-france-says-uk-quarantine-will-lead-to-reciprocal-measures-as-global-deaths-pass-750000,theguardian.com,2020-08-14 10:45:00,"Coronavirus live news: Italy orders travellers from Spain, Croatia, Malta and Greece to be tested as cases rise",en
ENTERTAINMENT,https://pitchfork.com/news/father-john-misty-shares-new-songs-to-s-and-to-r-listen/,pitchfork.com,2020-08-17 16:36:13,Father John Misty Shares New Songs “To S.” and “To R.”: Listen,en
BUSINESS,https://www.deccanherald.com/international/world-news-politics/china-inflation-edges-up-on-the-back-of-food-prices-871571.html,deccanherald.com,2020-08-10 04:18:21,China inflation edges up on the back of food prices,en
WORLD,https://www.bbc.com/news/world-middle-east-53758266,bbc.com,2020-08-12 18:41:40,Beirut blast: WHO warns dozens of health facilities 'non-functional',en
HEALTH,https://www.news-leader.com/story/news/local/ozarks/2020/08/13/covid-outbreak-greene-county-jail-inmates-speak-out-coronavirus-missouri/3351895001/,news-leader.com,2020-08-13 21:11:15,'It's a bad situation': Inside the Greene County jail's COVID-19 outbreak,en
BUSINESS,https://www.marketwatch.com/story/a-bullish-golden-cross-is-forming-in-the-dow-industrials-11596740412,marketwatch.com,2020-08-06 19:00:00,A 'golden cross' has formed in the Dow Jones Industrial Average,en
TECHNOLOGY,https://bgr.com/posts/5864450/ee26eb-why-is-fortnite-off-the-app-store-but-still-available-on-consoles/,bgr.com,2020-08-17 18:43:10,Epic's 'Fortnite' lawsuit against Apple and Google isn't as noble as it seems,en
ENTERTAINMENT,https://www.mamamia.com.au/love-on-the-spectrum-michael/,mamamia.com.au,2020-08-03 14:00:00,He's the hero we need during this pandemic: The world has fallen in love with 25yo Michael.,en
TECHNOLOGY,https://www.polygon.com/2020/8/3/21352584/animal-crossing-new-horizons-acnh-king-tut-mask-race-musical-chairs-minigame-nintendo-switch,polygon.com,2020-08-03 15:46:40,Animal Crossing: New Horizons fans are playing King Tut minigames,en
WORLD,https://www.express.co.uk/news/politics/1320317/Travel-warning-travel-restrictions-quarantine-rule,express.co.uk,2020-08-08 11:02:00,Travel warning: UK must expect more restrictions on foreign travel,en
SPORTS,https://www.nytimes.com/2020/08/14/sports/basketball/gregg-popovich-spurs-playoff-streak.html,nytimes.com,2020-08-14 07:42:58,The N.B.A. Bubble Bursts for Gregg Popovich and the Spurs,en
TECHNOLOGY,https://mobilesyrup.com/2020/08/14/epic-google-oneplus-preload-epic-games-app/,mobilesyrup.com,2020-08-14 18:44:00,Epic claims Google stopped OnePlus from preloading Fortnite installer on its phones,en
SCIENCE,https://www.ajc.com/news/world/perseid-meteor-shower-2018-how-and-when-watch-the-sky-best-show-the-year/z38vgMju4GvdpyT8GqWvuN/,ajc.com,2018-08-03 18:40:59,Perseid meteor shower 2020: How and when to watch the sky’s best show of the year,en
WORLD,https://www.thezimbabwemail.com/world-news/namibia-rejects-involvement-in-zimbabwean-affairs/,thezimbabwemail.com,2020-08-07 11:05:51,Namibia rejects involvement in Zimbabwean affairs – The Zimbabwe Mail,en
TECHNOLOGY,https://www.nzherald.co.nz/lifestyle/news/article.cfm?c_id=6&objectid=12357062,nzherald.co.nz,2020-08-16 22:44:53,The Conversation: TikTok can be good for your kids if you follow a few tips to stay safe,en
NATION,https://www.livemint.com/industry/banking/hdfc-bank-s-independence-day-gift-to-armed-forces-personnel-shaurya-kgc-card-11597398789401.html,livemint.com,2020-08-14 10:23:00,HDFC Bank's Independence Day gift to armed forces personnel: Shaurya KGC Card,en
ENTERTAINMENT,https://guardian.ng/life/musician-frank-oceans-brother-reportedly-dead-in-tragic-car-accident/,guardian.ng,2020-08-03 08:49:00,Musician Frank Ocean's Brother Reportedly Dead In Tragic Car Accident,en
WORLD,https://www.vanguardngr.com/2020/08/corruption-taking-its-toll-on-fgs-anti-graft-war-forensic-investigator/,vanguardngr.com,2020-08-02 12:39:00,Corruption taking its toll on FG’s anti-graft war – forensic investigator,en
TECHNOLOGY,https://www.essentiallysports.com/call-of-duty-warzone-devs-roll-out-another-patch-news-esports/,essentiallysports.com,2020-08-06 11:35:49,Call Of Duty Warzone: Devs Roll Out Another Patch,en
TECHNOLOGY,https://www.techtimes.com/articles/251671/20200809/look-league-legends-150th-champ-yone-secret-interaction-yasuo%E2%80%94and-everything.htm,techtimes.com,2020-08-10 01:43:15,LOOK: League of Legends' 150th Champ Yone Secret Interaction with Yasuo—and Everything You Need to Know,en
ENTERTAINMENT,https://timesofindia.indiatimes.com/entertainment/hindi/bollywood/news/anil-kapoor-to-shilpa-shetty-kundra-b-town-celebs-wish-for-abhisheks-speedy-recovery-as-he-shares-photo-of-her-care-board-from-hospital/articleshow/77385506.cms,timesofindia.indiatimes.com,2020-08-06 04:17:00,Anil Kapoor to Shilpa Shetty Kundra: B-town celebs pray for Abhishek Bachchan's speedy recovery as he sha,en
WORLD,https://www.thesun.co.uk/news/12370003/tech-millionaire-john-mcafee-arrested-thong-coronavirus-mask-norway/,thesun.co.uk,2020-08-11 08:49:00,Eccentric tech millionaire John McAfee arrested after wearing ‘safe lacy thong as a coronavirus mask’ in Nor,en
TECHNOLOGY,https://www.thestar.com.my/tech/tech-news/2020/08/05/samsung-launches-galaxy-note-20-with-five-other-devices,thestar.com.my,2020-08-05 14:00:00,Samsung launches Galaxy Note 20 series with five other devices,en
ENTERTAINMENT,https://www.theguardian.com/music/2020/aug/14/burna-boy-twice-as-tall-review-nigeria-pop-polymath,theguardian.com,2020-08-14 15:35:00,Burna Boy: Twice as Tall review – fun and fury from Nigerian pop polymath,en
TECHNOLOGY,https://tech.hindustantimes.com/mobile/news/top-android-11-features-you-should-be-excited-about-71597644662393.html,tech.hindustantimes.com,2020-08-17 06:11:02,Top Android 11 features you should be excited about,en
WORLD,https://www.express.co.uk/news/world/1319276/wuhan-china-news-wuhan-china-patients-infections-lung-damage-months-latest,express.co.uk,2020-08-06 03:07:00,Wuhan horror: Chinese patients STILL suffering lung damage from deadly virus months later,en
SPORTS,https://www.houstonchronicle.com/texas-sports-nation/rockets/article/Rockets-bring-their-best-to-top-matchups-15462263.php,houstonchronicle.com,2020-08-05 23:34:50,Rockets bring their best to top matchups,en
NATION,https://www.thisdaylive.com/index.php/2020/08/06/fg-begins-negotiation-for-covid-19-vaccine-supply/,thisdaylive.com,2020-08-06 03:23:24,FG Begins Negotiation for COVID-19 Vaccine Supply,en
SPORTS,https://www.sportsmole.co.uk/football/barcelona/champions-league/preview/preview-barcelona-vs-napoli-prediction-team-news-lineups_409283.html,sportsmole.co.uk,2020-08-06 12:09:25,"Preview: Barcelona vs Napoli - prediction, team news, lineups",en
BUSINESS,https://www.bloomberg.com/tosv2.html?vid=&uuid=07fabe20-df12-11ea-b1dd-35dcc00daf25&url=L25ld3MvYXJ0aWNsZXMvMjAyMC0wOC0xNS9jaXRpLXMtOTAwLW1pbGxpb24tYmx1bmRlci1yYWlzZXMtc3Rha2VzLWluLXJldmxvbi1zaG93ZG93bg==,bloomberg.com,2020-08-15 00:12:00,Citi’s $900 Million ‘Clerical Error’ Is Worst Wall Street Bungle in a Long Time,en
BUSINESS,https://www.smh.com.au/business/companies/unacceptable-failures-super-funds-call-rio-tinto-to-account-over-cave-blast-20200812-p55l1m.html,smh.com.au,2020-08-12 14:00:00,'Unacceptable failures': Super funds call Rio Tinto to account over cave blast,en
SPORTS,https://www.uefa.com/uefaeuropaleague/match/2028229--sevilla-vs-roma/postmatch/report/,uefa.com,2020-08-06 19:41:00,Sevilla 2-0 Roma: Spanish side ease into last eight,en
ENTERTAINMENT,https://www.express.co.uk/news/royal/1323388/Prince-Philip-news-world-war-two-duke-of-edenborough-VJ-day-hms-whelp-japan-royal-family,express.co.uk,2020-08-16 02:10:29,Prince Philip’s heroic VJ Day history honoured by Royal Family in release of WW2 photos,en
SPORTS,https://www.startribune.com/penguins-won-t-give-wild-2020-first-round-pick/572091702/,startribune.com,2020-08-12 21:56:15,Penguins won't give Wild 2020 first-round pick,en
NATION,https://www.thesun.co.uk/news/12420858/olga-freeman-charged-murder-photographer-son-west-london/,thesun.co.uk,2020-08-17 09:18:00,"Olga Freeman, 40, charged with murder of celebrity photographer’s disabled son, 10, in Acton after screams h",en
SPORTS,https://www.rugbypass.com/news/youre-fd-mate-the-three-words-eddie-jones-used-to-end-dylan-hartley-england-career/,rugbypass.com,2020-08-14 17:08:37,'You're f****d': Jones' Hartley goodbye,en
WORLD,https://tribune.com.pk/story/2258710/arab-countries-report-more-deaths-from-covid-19,tribune.com.pk,2020-08-09 07:50:53,Arab countries report more deaths from Covid-19,en
