topic,link,domain,published_date,title,lang
HEALTH,https://www.sfchronicle.com/bayarea/article/California-cases-flattening-says-Bay-Area-expert-15461914.php,sfchronicle.com,2020-08-05 21:47:50,"California cases flattening, says Bay Area expert — but data glitch raises doubts",en
TECHNOLOGY,https://www.nintendolife.com/news/2020/08/dragon_marked_for_death_adds_new_final_boss_new_quest_and_end-game_weapons,nintendolife.com,2020-08-07 05:45:00,"Dragon: Marked For Death Adds New Final Boss, New Quest And End-Game Weapons",en
TECHNOLOGY,https://www.pushsquare.com/news/2020/08/sonys_finally_resolved_the_ps_stores_biggest_flaw,pushsquare.com,2020-08-10 10:30:00,Sony's Finally Resolved the PS Store's Biggest Flaw,en
BUSINESS,https://galusaustralis.com/2020/08/803864/global-solid-acid-catalyst-market-2020-with-coronavirus-covid-19-impact-analysis-likewise-industry-is-booming-globaly-with-top-players-johnson-matthey-iogen-corp-axens-evonik-industries-ag-w-r/,galusaustralis.com,2020-08-09 10:05:15,"Global Solid Acid Catalyst Market 2020 with Coronavirus/COVID-19 Impact Analysis | likewise Industry is Booming Globaly with Top Players | Johnson Matthey, Iogen Corp, Axens, Evonik Industries AG, W.R.Grace&Co",en
ENTERTAINMENT,https://www.billboard.com/articles/columns/hip-hop/9432769/juice-wrld-animated-video-smile-the-weeknd,billboard.com,2020-08-12 12:01:19,Juice WRLD Sprouts Wings in Dreamy Animated Video For 'Smile' With The Weeknd,en
SCIENCE,https://www.eurekalert.org/pub_releases/2020-08/acs-mhm072320.php,eurekalert.org,2020-08-17 09:02:16,"More healthful milk chocolate by adding peanut, coffee waste",en
BUSINESS,https://www.cbsnews.com/news/anthony-levandowski-google-engineer-uber-prison-stealing-robocar-secrets/,cbsnews.com,2020-08-05 14:42:00,Former Google engineer sent to prison for stealing robocar secrets,en
WORLD,https://www.thesundaily.my/world/millions-return-to-lockdown-in-philippines-as-covid-19-cases-soar-HH3283081,thesundaily.my,2020-08-03 04:56:00,Millions return to lockdown in Philippines as Covid-19 cases soar,en
SPORTS,https://www.givemesport.com/1592730-newcastle-takeover-new-company-claim-theyve-made-offer-and-want-to-sign-ronaldo,givemesport.com,2020-08-17 19:24:26,Newcastle takeover: New company claim they've made offer - and want to sign Ronaldo,en
SPORTS,https://menafn.com/1100594391/COVID-19-PCB-to-give-monthly-stipend-to-25-unemployed-women-players,menafn.com,2020-08-06 07:32:52,COVID-19: PCB to give monthly stipend to 25 unemployed women players,en
ENTERTAINMENT,https://www.bbc.com/news/uk-wales-53719969,bbc.com,2020-08-10 09:34:11,I'm A Celebrity could swap Australian bush for haunted Gwrych Castle,en
TECHNOLOGY,https://www.iol.co.za/technology/mobile/whatsapp-adds-ability-to-cross-check-forwarded-messages-2304fc3b-f576-4f7c-9196-c824c1e666fa,iol.co.za,2020-08-05 13:12:04,WhatsApp adds ability to cross-check forwarded messages,en
WORLD,https://www.thestar.com.my/aseanplus/aseanplus-news/2020/08/06/china-welcomes-philippines039-stance-on-south-china-sea,thestar.com.my,2020-08-06 03:00:00,China welcomes Philippines' stance on South China Sea,en
SPORTS,https://www.news24.com/sport/golf/pgachampionship/the-6-golfers-flying-sa-flag-high-at-pga-championship-20200806,news24.com,2020-08-06 08:55:25,The 6 golfers flying SA flag high at PGA Championship,en
HEALTH,http://www.gdnonline.com/Details/839714,gdnonline.com,2020-08-11 14:41:24,"Health: Delay routine dental checkups, WHO urges, until Covid-19 risk is known",en
WORLD,https://www.ft.com/content/91218921-105c-4287-8cfb-f3161d8ed8e8,ft.com,2020-08-07 14:12:00,Former Saudi official accuses crown prince of assassination attempt,en
NATION,https://www.smh.com.au/national/women-of-australia-the-shark-punching-hero-from-port-macquarie-is-no-big-deal-20200817-p55mfw.html,smh.com.au,2020-08-17 14:07:00,"Women of Australia, the shark-punching hero from Port Macquarie is no big deal",en
ENTERTAINMENT,https://www.eonline.com/news/1178352/justin-hartleys-ex-defends-him-after-chrishell-stause-shares-shocking-details-on-selling-sunset,eonline.com,2020-08-12 01:54:00,Justin Hartley's Ex Defends Him After Chrishell Stause Shares Shocking Details On Selling Sunset,en
SPORTS,https://www.nba.com/nets/news/feature/2020/08/07/brooklyn-nets-clinch-a-return-to-nba-playoffs,nba.com,2020-08-08 02:03:45,Brooklyn Nets Clinch a Return to NBA Playoffs,en
HEALTH,https://www.genengnews.com/news/potential-biomarker-discovered-for-diagnosing-early-stage-cancer/,genengnews.com,2020-08-17 08:00:00,Potential Biomarker Discovered for Diagnosing Early-Stage Cancer,en
HEALTH,https://www.timesnews.net/living/extra-weight-can-be-a-deadly-complication-when-fighting-covid-19/article_e1bb01e6-d1a3-11ea-950c-971f63bc8d42.html,timesnews.net,2020-08-10 03:45:00,Extra weight can be a deadly complication when fighting COVID-19,en
SPORTS,https://www.thescore.com/nba/news/2001590,thescore.com,2020-08-13 03:45:00,Heat's Butler voices displeasure with CP3's antics toward Robinson,en
HEALTH,https://www.telegraph.co.uk/news/2020/08/14/midlife-weight-loss-unlikely-reduce-risk-early-death-scientists/,telegraph.co.uk,2020-08-14 16:19:00,"Midlife weight loss unlikely to reduce risk of an early death, scientists find",en
ENTERTAINMENT,https://www.cosmopolitan.com/uk/beauty-hair/celebrity-hair-makeup/a33495833/adele-long-wavy-blonde-hair/,cosmopolitan.com,2020-08-03 09:49:00,"Adele looks *unrecognisable* with new wavy, bleach-blonde hair",en
SPORTS,https://www.espn.com/college-sports/story/_/id/29601895/ncaa-division-iii-fall-championships-canceled,espn.com,2020-08-05 19:02:25,NCAA D-II and D-III fall championships canceled,en
TECHNOLOGY,https://www.cnet.com/features/microsofts-two-screen-surface-duo-isnt-an-iphone-or-galaxy-fold-and-thats-the-point/,cnet.com,2020-08-12 11:27:35,Microsoft's two-screen Surface Duo isn't an iPhone or Galaxy Fold. That's the point,en
BUSINESS,https://www.bloombergquint.com/economy-finance/indias-mpc-runs-the-risk-of-failing-the-three-strikes-rule,bloombergquint.com,2020-08-14 09:19:47,India’s MPC Runs The Risk Of Failing The Three-Strikes Rule,en
NATION,https://communalnews.com/coronavirus-2473-new-cases-in-indonesia/,communalnews.com,2020-08-08 13:34:00,Coronavirus — 2473 New Cases in Indonesia,en
ENTERTAINMENT,https://www.express.co.uk/news/royal/1321732/jeffrey-epstein-news-ghislaine-maxwell-prince-andrew-royal-family-latest-spt,express.co.uk,2020-08-12 12:11:00,Epstein and Maxwell’s timeline: Duo mingled with Andrew and wider Royal Family for YEARS,en
NATION,https://www.thesun.co.uk/news/12416446/man-dies-wetherspoons-break-up-fight-sedgley/,thesun.co.uk,2020-08-17 11:00:00,"‘Gentle giant’ dad, 24, was beaten to death by five thugs outside Wetherspoons as he tried to break up fig",en
WORLD,https://www.theguardian.com/us-news/2020/aug/12/bob-woodward-donald-trump-book-rage-kim-jong-un,theguardian.com,2020-08-13 01:56:00,Bob Woodward obtains letters between Trump and Kim Jong-un for new book Rage,en
WORLD,https://www.stuff.co.nz/national/health/coronavirus/122469772/coronavirus-dunedin-school-introduces-mask-monday-to-normalise-face-mask-use-among-students,stuff.co.nz,2020-08-17 03:05:00,Coronavirus: Dunedin school introduces Mask Monday to normalise face mask use among students,en
NATION,https://www.asiaone.com/singapore/she-consented-says-personal-trainer-accused-groping-client,asiaone.com,2020-08-05 09:35:00,"She consented, says personal trainer accused of groping client",en
TECHNOLOGY,https://www.firstpost.com/tech/gaming/xbox-series-x-will-launch-in-november-this-year-while-halo-infinite-launch-to-see-a-delay-8700671.html,firstpost.com,2020-08-12 12:17:16,Xbox Series X will launch in November this year while Halo Infinite launch to see a delay,en
NATION,https://www.stuff.co.nz/national/122405030/we-are-lucky-says-dean-of-dunedins-firedamaged-st-pauls-cathedral,stuff.co.nz,2020-08-10 23:51:00,"'We are lucky', says dean of Dunedin's fire-damaged St Paul's Cathedral",en
HEALTH,https://www.kmov.com/news/covid-19-outbreak-killed-416-residents-of-st-louis-county-long-term-care-facilities/article_82c6fcb8-c95a-11ea-8c03-63002ee1f978.html,kmov.com,2020-08-04 22:00:00,COVID-19 outbreak killed 416 residents of St. Louis County long-term care facilities,en
TECHNOLOGY,https://www.firstpost.com/tech/news-analysis/samsung-galaxy-unpacked-2020-to-kick-off-at-7-30-pm-ist-today-how-to-watch-the-livestream-8667151.html,firstpost.com,2020-08-05 02:52:22,Samsung Galaxy Unpacked 2020 to kick off at 7.30 pm IST today: How to watch the livestream,en
BUSINESS,https://www.helpnetsecurity.com/2020/08/12/perimeter-81-series-b/,helpnetsecurity.com,2020-08-11 22:30:00,Perimeter 81 raises $40M to support growth and accelerate hiring and development,en
BUSINESS,https://www.usatoday.com/story/money/2020/08/15/19-groceries-driving-up-your-bill-the-most-during-pandemic/42206031/,usatoday.com,2020-08-15 10:00:44,Coronavirus crisis: These 19 groceries have driven up your bill the most during pandemic,en
TECHNOLOGY,https://www.bbc.com/news/av/uk-england-birmingham-53768183/the-black-women-in-tech-coding-the-future,bbc.com,2020-08-16 13:01:14,The black women in tech coding the future,en
NATION,https://tribune.com.pk/story/2258608/businesses-to-reopen-from-monday-in-sindh,tribune.com.pk,2020-08-08 19:48:48,Businesses to reopen from Monday in Sindh,en
NATION,https://www.thestar.com.my/news/nation/2020/08/03/foreign-nationals-seen-in-viral-video-over-assault-of-security-guard-barred-from-leaving-country-says-bukit-aman,thestar.com.my,2020-08-03 12:35:00,"Foreign nationals seen in viral video over assault of security guard barred from leaving country, says Bukit Aman",en
TECHNOLOGY,https://timesofindia.indiatimes.com/auto/cars/ford-gt-heritage-edition-unveiled/articleshow/77584839.cms,timesofindia.indiatimes.com,2020-08-17 05:03:00,Ford GT Heritage Edition unveiled,en
TECHNOLOGY,https://www.pcgamer.com/au/halo-infinite-delayed-to-2021/,pcgamer.com,2020-08-11 19:10:00,Halo Infinite delayed to 2021,en
TECHNOLOGY,https://www.livescience.com/arecibo-observatory-massive-damage.html,livescience.com,2020-08-14 11:21:00,Famous alien-hunting telescope slashed to pieces in mysterious midnight accident,en
TECHNOLOGY,https://www.engadget.com/fortnite-xcloud-app-store-130053155.html,engadget.com,2020-08-14 13:50:55,Huge video game companies are exposing Apple's iOS hypocrisy,en
ENTERTAINMENT,https://www.cheatsheet.com/entertainment/sharon-stone-was-struck-by-lightning-and-evaded-death-2-other-times.html/,cheatsheet.com,2020-08-10 01:48:29,Sharon Stone Was Struck by Lightning and Evaded Death 2 Other Times,en
HEALTH,http://dunyanews.tv/en/World/559388-Australia/'s-Victoria-reports-deadliest-day-of-pandemic-with-25-fatalitie,dunyanews.tv,2020-08-17 01:36:00,Australia's Victoria reports deadliest day of pandemic with 25 fatalities,en
NATION,http://saharareporters.com/2020/08/07/edo-state-oshiomole-vs-obaseki-both-sides-story-vs-one-side-truth-frisky-larr,saharareporters.com,2020-08-07 06:49:10,Edo State: Oshiomole vs. Obaseki: Both Sides Of The Story vs. One Side Of The Truth By Frisky Larr,en
SPORTS,https://www.pgatour.com/tournaments/tour-championship/newsletter.html,pgatour.com,2020-08-04 20:08:26,TOUR Championship: Newsletter,en
TECHNOLOGY,https://www.pcmag.com/how-to/things-every-parent-with-a-connected-kid-needs-to-know,pcmag.com,2020-08-12 13:07:58,10 Things Every Parent With a Connected Kid Needs to Know,en
NATION,https://www.abc.net.au/news/2020-08-04/police-investigate-man-acting-indecently-towards-adelaide-teens/12523174,abc.net.au,2020-08-04 06:36:00,SA Police investigating man acting indecently towards teenagers in Adelaide suburb of Kingswood,en
HEALTH,https://www.bloombergquint.com/onweb/forced-isolation-may-be-the-only-way-to-stop-resurgence-of-virus,bloombergquint.com,2020-08-13 21:35:10,Forced Isolation May Be the Only Way to Stop Resurgence of Virus,en
BUSINESS,https://www.forbes.com/sites/brucejapsen/2020/08/06/pfizer-ceo-bourla-we-will-know-by-october-whether-our-covid-19-works/,forbes.com,2020-08-06 18:16:00,Pfizer CEO Bourla: We’ll Know By October Whether Our Covid-19 Vaccine Works,en
BUSINESS,https://www.reuters.com/article/canada-economy-ivey/canadas-ivey-pmi-shows-acceleration-in-july-purchasing-activity-idUSL1N2F818Q,reuters.com,2020-08-07 14:21:00,Canada's Ivey PMI shows acceleration in July purchasing activity,en
WORLD,https://www.cnn.com/2020/08/17/politics/democratic-convention-bernie-sanders-michelle-obama/index.html,cnn.com,2020-08-18 02:55:00,Democrats aim to show off a broad coalition on first night of DNC,en
BUSINESS,https://www.timesnownews.com/auto/features/article/ambassador-maruti-800-and-tata-indica-indian-cars-that-changed-the-automobile-world/637253,timesnownews.com,2020-08-15 03:31:00,"Ambassador, Maruti 800, Tata Indica, and more: Indian cars that changed automobile world",en
HEALTH,https://www.whitsundaytimes.com.au/news/covid-19-authorities-update-condition-of-hospitali/4079048/,whitsundaytimes.com.au,2020-08-14 22:48:00,COVID-19: Updated condition of local hospitalised couple,en
WORLD,https://www.scmp.com/news/hong-kong/health-environment/article/3096717/hong-kong-third-wave-death-toll-mounts-among,scmp.com,2020-08-10 09:35:45,"Hong Kong records three more Covid-19 deaths, another 69 cases",en
NATION,https://www.news18.com/news/india/will-soon-get-back-to-work-after-recovery-no-need-to-worry-cm-yediyurappa-in-video-2753383.html,news18.com,2020-08-03 10:01:00,"Will Soon Get Back to Work after Recovery, No Need to Worry: CM Yediyurappa in Video",en
SPORTS,https://www.liverpool.com/liverpool-fc-news/features/liverpool-man-city-premier-league-18702701,liverpool.com,2020-08-02 22:00:00,"Man City have made signing they believe topples Liverpool, making title race set-up far different",en
ENTERTAINMENT,https://www.syfy.com/syfywire/the-boys-tease-whale-guts-darker-starlight-and-more,syfy.com,2020-08-06 21:20:07,'The Boys' crew digs into why that whale scene is just the tip of the iceberg for an even wilder S2,en
WORLD,https://www.thejournal.ie/joe-biden-kamala-harris-first-rally-5174515-Aug2020/,thejournal.ie,2020-08-13 06:13:00,Biden and Harris vow to 'rebuild' America post-Trump,en
SCIENCE,https://www.canewsottawa.ca/british-fossil-hunters-locate-bones-of-new-dinosaur-species-cousin-to-t-rex-secret-life-of-sharks-and-more/,canewsottawa.ca,2020-08-15 08:23:43,"British fossil hunters locate bones of new dinosaur species, cousin to T.Rex 'Secret' life of sharks and more",en
BUSINESS,https://www.kitco.com/news/2020-08-04/U-S-equities-won-t-revisit-March-lows-corporate-defaults-next-trigger-El-Erian.html,kitco.com,2020-08-04 21:06:00,"U.S. equities won't revisit March lows, corporate defaults next trigger: El-Erian",en
ENTERTAINMENT,https://variety.com/2020/film/news/kurt-luedtke-dead-dies-out-of-africa-1234730856/,variety.com,2020-08-10 22:44:00,"Screenwriter Kurt Luedtke, Oscar Winner for ‘Out of Africa,’ Dies at 80",en
WORLD,https://www.aljazeera.com/news/2020/08/years-yazidis-iraq-demand-justice-isil-persecution-200804111313014.html,aljazeera.com,2020-08-04 12:35:00,"Six years on, Yazidis in Iraq demand justice for ISIL persecution",en
ENTERTAINMENT,https://www.nytimes.com/aponline/2020/08/10/sports/ap-us-obit-kamala-the-ugandan-giant.html,nytimes.com,2020-08-10 23:48:00,Pro Wrestling Star James 'Kamala' Harris Dies at 70,en
HEALTH,https://financialpost.com/pmn/business-pmn/u-s-cdc-reports-5285546-coronavirus-cases,financialpost.com,2020-08-15 17:52:46,US CDC reports 5285546 coronavirus cases,en
ENTERTAINMENT,https://www.refinery29.com/en-gb/2020/08/9969208/who-is-blonde-woman-in-silver-car-lovecraft-country,refinery29.com,2020-08-17 10:37:00,What’s Up With The Silver Car In Lovecraft Country?,en
HEALTH,https://wgxa.tv/news/local/houston-county-school-district-reports-6-more-schools-have-covid-19-cases,wgxa.tv,2020-08-12 20:23:00,Houston County School District reports 6 more schools have COVID-19 cases,en
ENTERTAINMENT,https://www.wiltonbulletin.com/local/article/HBO-comedian-goes-on-rant-against-Danbury-15489277.php,wiltonbulletin.com,2020-08-17 14:54:00,'Come get a thrashing from John Oliver': HBO comedian goes on rant against Danbury,en
WORLD,https://sg.news.yahoo.com/women-working-from-home-are-still-dealing-with-comments-about-their-appearance-050053478.html,sg.yahoo.com,2020-08-08 05:20:19,Women working from home are still dealing with comments about their appearance,en
TECHNOLOGY,https://www.zdnet.com/article/fbi-issues-warning-over-windows-7-end-of-life/,zdnet.com,2020-08-05 12:03:00,FBI issues warning over Windows 7 end-of-life,en
WORLD,https://www.theguardian.com/world/2020/aug/10/global-report-covid-cases-worldwide-near-20-million-as-australia-suffers-deadliest-day,theguardian.com,2020-08-10 05:20:00,Global report: Covid cases worldwide near 20 million as Australia suffers deadliest day,en
SPORTS,https://www.dailymail.co.uk/sport/football/article-8600367/Eric-Garcia-NOT-sign-new-Manchester-City-contract-reveals-Pep-Guardiola.html,dailymail.co.uk,2020-08-06 13:24:00,"Eric Garcia will NOT sign a new Manchester City contract, reveals Pep Guardiola",en
SPORTS,https://www.cbssports.com/nhl/news/2020-nhl-playoffs-scores-maple-leafs-stay-alive-blackhawks-canadiens-coyotes-canucks-islanders-advance/live/,cbssports.com,2020-08-08 06:21:00,"2020 NHL Playoffs scores: Maple Leafs stay alive, Blackhawks, Canadiens, Coyotes, Canucks, Islanders advance",en
BUSINESS,https://www.coindesk.com/crypto-hedge-funds-outlook,coindesk.com,2020-08-16 21:02:31,The Surprisingly Sunny Outlook for Crypto Hedge Funds,en
NATION,https://www.ghanaweb.com/GhanaHomePage/NewsArchive/Eastern-Region-developing-into-a-major-rice-production-area-1033804,ghanaweb.com,2020-08-14 12:18:09,Eastern Region developing into a major rice production area,en
SPORTS,https://www.taiwannews.com.tw/en/news/3979920,taiwannews.com.tw,2020-08-03 20:07:00,List of sports events affected by the coronavirus pandemic,en
WORLD,https://www.dailymaverick.co.za/article/2020-08-07-explosive-compound-that-decimated-beirut-was-meant-for-mozambique/,dailymaverick.co.za,2020-08-06 23:26:40,Explosive compound that decimated Beirut was meant for Mozambique,en
NATION,https://www.herald.co.zw/tourism-strategy-launched/,herald.co.zw,2020-08-05 23:22:49,Tourism strategy launched,en
ENTERTAINMENT,https://www.news.com.au/entertainment/celebrity-life/royals/new-book-finding-freedom-details-rift-between-the-duke-and-duchess-of-sussex-and-the-royals/news-story/53ebe082800439341b9d4ccb343c6abe,news.com.au,2020-08-11 08:37:30,"Finding Freedom: New Meghan Markle, Prince Harry book exposes royal family rift",en
TECHNOLOGY,https://www.techradar.com/nz/news/first-samsung-galaxy-watch-3-software-update-adds-several-missing-features,techradar.com,2020-08-09 09:30:00,First Samsung Galaxy Watch 3 software update adds several missing features,en
ENTERTAINMENT,https://www.news.com.au/entertainment/celebrity-style/stylist-claims-jlo-jessica-alba-and-katherine-heigl-are-the-worst-celebs-to-work-with/news-story/a9c1c13b89e14c5d1dd164f542582641,news.com.au,2020-08-09 05:31:25,"Stylist names worst stars to work with: J.Lo, Jessica Alba, Katherine Heigl",en
WORLD,https://guardian.ng/news/eight-killed-in-colombian-coca-growing-area/,guardian.ng,2020-08-16 15:28:00,Eight killed in Colombian coca-growing areaWorld,en
HEALTH,https://www.indiatvnews.com/news/world/us-hits-5-million-confirmed-coronavirus-cases-highest-in-the-world-640842,indiatvnews.com,2020-08-09 15:01:51,"US hits 5 million confirmed coronavirus cases, highest in the world",en
SPORTS,https://lonzowire.usatoday.com/2020/08/04/zion-williamson-news-new-orleans-pelicans-fourth-quarter-minutes-restriction-brandon-ingram-jrue-holiday/,lonzowire.usatoday.com,2020-08-04 13:05:54,Jrue Holiday on Zion Williamson closing games: 'It makes it easier on us',en
TECHNOLOGY,https://www.nag.co.za/2020/08/04/diablo-immortal-gets-a-chinese-gameplay-trailer/,nag.co.za,2020-08-04 08:21:00,Diablo: Immortal gets a Chinese gameplay trailer > NAG,en
NATION,https://www.theage.com.au/national/victoria/four-charged-with-murder-one-year-after-man-s-body-found-in-caravan-20200807-p55jfb.html,theage.com.au,2020-08-06 22:44:00,Four charged with murder one year after man's body found in caravan,en
HEALTH,https://www.reuters.com/article/uk-factcheck-legionnaires/fact-check-you-cant-catch-legionnaires-disease-by-wearing-a-face-mask-idUSKCN25128Y,reuters.com,2020-08-05 15:15:00,Fact check: You can't catch Legionnaires’ disease by wearing a face mask,en
BUSINESS,http://www.globenewswire.com/news-release/2020/08/04/2072166/0/en/Automotive-Ceramics-Market-Size-to-Hit-USD-2-11-Billion-till-2027-Increasing-Demand-for-Advanced-Ceramics-to-Augment-Growth-Fortune-Business-Insights.html,globenewswire.com,2020-08-04 08:00:00,Automotive Ceramics Market Size to Hit USD 2.11 Billion till 2027; Increasing Demand for Advanced Ceramics to Augment Growth: Fortune Business Insights™,en
ENTERTAINMENT,https://images.dawn.com/news/1185637,images.dawn.com,2020-08-13 05:02:54,Sanjay Dutt asks fans not to speculate about his health,en
NATION,https://www.bbc.co.uk/news/uk-scotland-highlands-islands-53636066,bbc.co.uk,2020-08-03 10:28:29,Teenagers on inflatable doughnut rescued from sea,en
SPORTS,https://talksport.com/football/efl/741119/said-benrahma-transfer-chelsea-arsenal-aston-villa-leeds-united-west-ham-nutmeg/,talksport.com,2020-08-04 13:08:49,"Said Benrahma: Chelsea, Arsenal, Aston Villa, Leeds United and West Ham in the race for £25m star who ‘could n",en
ENTERTAINMENT,https://www.dailymail.co.uk/tvshowbiz/article-8589341/Gethin-Jones-left-Celebrity-MasterChef-suspected-COVID-19.html,dailymail.co.uk,2020-08-03 19:23:55,Celebrity MasterChef: Gethin Jones left amid coronavirus fears,en
NATION,https://www.thehindubusinessline.com/news/national/manoj-sinha-appointed-new-lieutenant-governor-of-jk/article32282352.ece,thehindubusinessline.com,2020-08-06 04:31:21,Manoj Sinha appointed new Lieutenant Governor of J&K,en
SCIENCE,https://www.firstpost.com/tech/science/tree-like-moxie-on-nasas-perseverance-rover-will-turn-carbon-dioxide-into-oxygen-on-mars-8691881.html,firstpost.com,2020-08-10 12:07:45,Tree-like MOXIE on NASA's Perseverance rover will turn carbon dioxide into oxygen on Mars,en
SPORTS,https://www.si.com/tennis/2020/08/15/serena-williams-loses-top-seed-open-coco-gauff-wins,si.com,2020-08-15 01:10:00,Serena Williams Loses to No. 116 Shelby Rogers in Top Seed Open Quarterfinals; Coco Gauff Wins,en
WORLD,https://ca.news.yahoo.com/tiktok-twins-charged-over-bank-151550315.html,ca.news.yahoo.com,2020-08-06 15:15:00,TikTok twins charged over bank robbery 'prank',en
HEALTH,https://telanganatoday.com/anxiety-can-harshly-impact-your-skin-hair,telanganatoday.com,2020-08-11 07:11:00,"Anxiety can harshly impact your skin, hair",en
NATION,https://www.foxnews.com/media/msnbc-gives-zero-coverage-chicago-riots-cnn-ignores,foxnews.com,2020-08-11 10:34:06,"MSNBC skips coverage of Chicago riots during prime time, CNN airs less than 3 minutes",en
SPORTS,https://sports.yahoo.com/darren-collison-says-talk-him-130004783.html,sports.yahoo.com,2020-08-04 13:00:00,Darren Collison says talk of him playing for Lakers was “overhyped”,en
SPORTS,https://www.lifeinnorway.net/norwegian-skiing-icon-petter-northug-caught-in-cocaine-scandal/,lifeinnorway.net,2020-08-15 13:18:45,Norwegian Skiing Icon Petter Northug Caught In Cocaine Scandal,en
HEALTH,https://www.surreycomet.co.uk/news/18643987.three-new-coronavirus-cases-kingston/,surreycomet.co.uk,2020-08-11 17:26:00,Three new coronavirus cases in Kingston,en
SPORTS,https://indianexpress.com/article/sports/cricket/the-r-word-perfect-timing-for-gavaskar-not-so-much-for-kapil-tragic-for-wadekar-6557430/,indianexpress.com,2020-08-17 15:13:16,"The ‘R’ Word: Perfect timing for Gavaskar, not so much for Kapil, tragic for Wadekar",en
ENTERTAINMENT,https://urbanislandz.com/2020/08/08/jahmiel-return-to-the-streets-in-new-visual/,urbanislandz.com,2020-08-08 17:24:00,Jahmiel “Return” To The Streets In New Visual,en
TECHNOLOGY,https://www.revu.com.ph/2020/08/vivo-x50-series-philippines-launch-date/,revu.com.ph,2020-08-10 07:13:48,Vivo X50 series Philippine launch scheduled for Aug 22,en
BUSINESS,https://www.moneycontrol.com/news/business/earnings/apollo-tyres-reports-net-loss-of-rs-135-crore-in-q1-as-covid-19-impacts-business-5651471.html,moneycontrol.com,2020-08-05 14:52:00,Apollo Tyres reports net loss of Rs 135 crore in Q1 as COVID-19 impacts business,en
WORLD,https://www.thesun.ie/news/5772359/terraced-house-no-front-door/,thesun.ie,2020-08-12 08:45:58,Cosy two-bed terraced house could be yours for just €230k but it has NO front door,en
HEALTH,https://news.yahoo.com/major-coronavirus-developments-friday-14-august-140019967.html,news.yahoo.com,2020-08-14 14:00:00,Coronavirus: The 17 major developments that happened on Friday,en
HEALTH,https://news.cgtn.com/news/2020-08-04/Climate-caused-deaths-could-soar-by-century-s-end-study-SGACCo4oak/index.html,news.cgtn.com,2020-08-04 13:02:27,Climate-caused deaths could soar by century's end: study,en
BUSINESS,https://finance.yahoo.com/news/softbank-bets-3-9-billion-015318398.html,finance.yahoo.com,2020-08-18 02:26:08,SoftBank Bets $3.9 Billion on U.S. Giants From Amazon to Tesla,en
HEALTH,https://www.eureporter.co/frontpage/2020/08/04/uk-to-roll-out-millions-of-rapid-covid-tests-after-criticism/,eureporter.co,2020-08-04 06:45:23,UK to roll out millions of rapid #COVID tests after criticism,en
WORLD,https://guardian.ng/news/us-hits-5-million-virus-cases-as-trump-criticised-over-relief-package/,guardian.ng,2020-08-09 17:37:00,US hits 5 million virus cases as Trump criticised over relief package,en
