topic,link,domain,published_date,title,lang
TECHNOLOGY,https://www.androidcentral.com/motorola-has-best-android-software-no-one-talks-about,androidcentral.com,2020-08-03 11:30:03,Motorola has the best Android software that no one talks about,en
BUSINESS,https://www.globenewswire.com/news-release/2020/08/04/2072779/0/en/The-Global-Plastic-Based-Egg-Packaging-Market-is-expected-to-grow-by-772-76-mn-during-2020-2024-progressing-at-a-CAGR-of-5-during-the-forecast-period.html,globenewswire.com,2020-08-04 19:53:00,The Global Plastic-Based Egg Packaging Market is expected to grow by $ 772.76 mn during 2020-2024 progressing at a CAGR of 5% during the forecast period,en
TECHNOLOGY,https://www.businessinsider.com/how-google-is-thinking-about-its-next-billion-users-2020-8,businessinsider.com,2020-08-12 21:47:25,The pandemic has changed the way Google is thinking about its global 'Next Billion Users' strategy: 'We've almost hit a fast-forward button to 2030',en
ENTERTAINMENT,https://www.pulselive.co.ke/entertainment/zari-hassan-and-burna-boy-among-winners-at-the-2020-one-africa-awards-list/qb3r6ts,pulselive.co.ke,2020-08-13 09:16:52,Zari Hassan and Burna Boy among winners at the 2020 One Africa Awards (List),en
BUSINESS,https://www.globenewswire.com/news-release/2020/08/11/2076742/0/en/People-Corporation-to-Present-at-Canaccord-Genuity-40th-Annual-Growth-Conference.html,globenewswire.com,2020-08-11 20:15:00,People Corporation to Present at Canaccord Genuity 40th Annual Growth Conference,en
SPORTS,https://tv5.espn.com/nfl/story/_/id/29589585/broncos-right-tackle-jawuan-james-opt-season,tv5.espn.com,2020-08-03 18:11:15,Broncos starting right tackle Ja'Wuan James opts out of season,en
SCIENCE,https://www.sciencecodex.com/inexpensive-accessible-device-provides-visual-proof-masks-block-droplets-653691,sciencecodex.com,2020-08-07 04:00:00,"Inexpensive, accessible device provides visual proof that masks block droplets",en
HEALTH,https://www.eurekalert.org/pub_releases/2020-08/vumc-cs081720.php,eurekalert.org,2020-08-17 20:11:54,Cashew shell compound appears to mend damaged nerves,en
HEALTH,https://www.timesofisrael.com/in-deadliest-day-since-start-of-pandemic-17-succumb-to-virus-in-24-hours/,timesofisrael.com,2020-08-12 18:35:44,"In deadliest day since start of pandemic, 17 succumb to virus in 24 hours",en
HEALTH,https://www.stuff.co.nz/national/health/coronavirus/122337409/coronavirus-nz-could-end-up-like-melbourne-experts-warn,stuff.co.nz,2020-08-04 17:00:00,"Coronavirus: NZ could end up like Melbourne, experts warn",en
TECHNOLOGY,https://www.goal.com/en/news/fifa-21-how-toxic-behaviour-is-being-tackled-in-new-game/jb1wk61uf83o1rnp5qc01m5ry,goal.com,2020-08-04 17:00:00,FIFA 21: How 'toxic' behaviour is being tackled in new game,en
HEALTH,https://www.bloombergquint.com/businessweek/covid-vaccine-don-t-count-merck-out-of-the-race-just-yet,bloombergquint.com,2020-08-10 17:22:10,Merck Bets On a One-Shot Vaccine in Race With Its Faster Rivals,en
WORLD,https://www.bbc.co.uk/news/world-us-canada-53774077,bbc.co.uk,2020-08-14 05:08:29,US 'foils' militant cryptocurrency fundraising,en
HEALTH,https://wgme.com/news/local/at-least-35-potential-covid-19-spreaders-from-out-of-state-have-been-in-tourist-hot-spot,wgme.com,2020-08-04 10:51:00,At least 35 potential COVID-19 spreaders from out-of-state have been in tourist hot spot,en
NATION,https://www.timeslive.co.za/tshisa-live/tshisa-live/2020-08-10-somizi-gets-real-about-cellphone-addictions-sometimes-i-wish-to-be-touched-like-that-phone/,timeslive.co.za,2020-08-10 08:00:00,Somizi gets real about cellphone addictions: 'Sometimes I wish to be touched like that phone',en
SPORTS,https://www.espn.com/college-football/story/_/id/29600577/uconn-becomes-1st-fbs-team-cancel-football-season-due-coronavirus,espn.com,2020-08-05 12:50:47,UConn becomes first FBS team to cancel football season because of coronavirus,en
TECHNOLOGY,https://tech.hindustantimes.com/mobile/news/samsung-galaxy-m51-support-page-goes-live-hints-towards-an-imminent-launch-71597056141696.html,tech.hindustantimes.com,2020-08-10 10:42:21,Galaxy M51 could be the next powerful Samsung mid-range phone in India,en
BUSINESS,https://www.bloomberg.com/tosv2.html?vid=&uuid=4bb09940-dc84-11ea-9e6b-c3edccde2f4e&url=L25ld3MvYXJ0aWNsZXMvMjAyMC0wOC0xMi9jYXRoYXktd2FybnMtYmlnZ2VzdC1jcmlzaXMtdG8tcGVyc2lzdC1hZnRlci0xLTMtYmlsbGlvbi1sb3Nz,bloomberg.com,2020-08-12 04:37:00,Cathay Soars as Airport Transfer Hopes Offset Bleak Outlook,en
TECHNOLOGY,https://www.cnet.com/how-to/all-the-ways-your-iphone-camera-will-get-better-when-ios-14-arrives-this-fall/,cnet.com,2020-08-05 09:00:03,All the ways your iPhone camera will get better when iOS 14 arrives this fall,en
SPORTS,https://www.rnz.co.nz/news/sport/423636/ms-dhoni-ends-speculation-around-his-international-future,rnz.co.nz,2020-08-15 18:42:51,MS Dhoni ends speculation around his international future,en
NATION,https://tribune.com.pk/story/2258122/court-remands-two-for-tossing-infant-from-building,tribune.com.pk,2020-08-05 13:32:10,Court remands two for tossing infant from building,en
SPORTS,https://www.mirror.co.uk/sport/football/transfer-news/psg-borussia-dortmund-monaco-three-22535514,mirror.co.uk,2020-08-17 14:54:00,"PSG, Borussia Dortmund and Monaco in three-way transfer battle for Wilfried Zaha",en
HEALTH,https://www.ktvq.com/news/coronavirus/yellowstone-county-reports-covid-19-related-deaths,ktvq.com,2020-08-08 16:21:29,Yellowstone County reports COVID-19 related deaths,en
ENTERTAINMENT,https://www.iheart.com/content/2020-08-03-drakes-son-is-all-smiles-in-cute-photo-with-mom-sophie-brussaux/,iheart.com,2020-08-03 20:41:58,Drake's Son Is All Smiles In Cute Photo With Mom Sophie Brussaux,en
ENTERTAINMENT,https://www.ghgossip.com/bbnaija-my-only-regret-is-not-being-able-to-use-the-jacuzzi-neo-tells-big-brother/,ghgossip.com,2020-08-02 14:29:00,"BBNaija: ""If I Leave The House, My Only Regret Will Be Not Being Able To Use The Jacuzzi "" - Neo Tells Big Brother",en
WORLD,https://www.wbrz.com/videos/thursday-morning-video-forecast-51856,wbrz.com,2020-08-13 11:43:00,Thursday morning video forecast,en
BUSINESS,https://www.theedgemarkets.com/article/fbm-klci-slid-19-%E2%80%94-biggest-singleday-drop-seven-weeks,theedgemarkets.com,2020-08-03 10:43:30,FBM KLCI slides 1.9% — biggest single-day drop in seven weeks,en
NATION,https://indianexpress.com/article/world/global-coronavirus-updates-12-august-australia-new-zealand-mexico-united-states-6551163/,indianexpress.com,2020-08-12 14:49:05,"Global Coronavirus Updates, 12 August: Switzerland to allow public gatherings from Oct 1; Russia to give medics anti-COVID shots in 2 weeks",en
ENTERTAINMENT,https://www.ndtv.com/entertainment/trending-what-kareena-kapoor-said-about-saif-ali-khan-as-a-husband-and-father-2278217,ndtv.com,2020-08-12 07:15:25,Trending: What Kareena Kapoor Said About Saif Ali Khan As A Husband And Father,en
BUSINESS,https://www.mirror.co.uk/money/yo-sushi-preparing-axe-250-22522327,mirror.co.uk,2020-08-14 13:51:00,Yo Sushi confirms plans to close 19 stores and axe 250 jobs - full list,en
SPORTS,https://www.goal.com/en-za/news/mamelodi-sundowns-mosimane-says-he-is-almost-done-with/c8zfavbbeglx1j7hddzbnjzb5,goal.com,2020-08-10 09:01:00,Mamelodi Sundowns’ Mosimane says he is almost done with transfer business for next season,en
WORLD,https://www.bbc.com/news/education-53759832,bbc.com,2020-08-13 00:15:31,Coronavirus: A-level results to arrive in year with no exams,en
SCIENCE,https://www.arabianbusiness.com/video/450457-video-first-aircraft-to-fly-on-another-planet,arabianbusiness.com,2020-08-05 06:49:00,Video: First aircraft to fly on another planet,en
HEALTH,https://www.independent.ie/world-news/coronavirus/soaring-virus-infection-rate-may-force-further-restrictions-here-39454620.html,independent.ie,2020-08-17 01:30:00,Soaring virus infection rate may force further restrictions here,en
SPORTS,https://futaa.com/ug/article/212223/cape-town-city-stun-sundowns-in-five-goal-thriller-chiefs-celebrate,futaa.com,2020-08-17 18:56:15,"🔵🔥👆🏿 Cape Town City stun Sundowns in five-goal thriller, Chiefs celebrate",en
NATION,https://www.cbc.ca/news/canada/nova-scotia/nova-scotia-covid-19-update-aug-15-2020-1.5687989,cbc.ca,2020-08-15 15:14:00,2 cases of COVID-19 detected in Nova Scotia,en
SCIENCE,https://www.zee5.com/zeekannada/calcium-rich-supernova-examined-with-x-rays-for-first-time/,zee5.com,2020-08-07 04:27:48,Calcium-rich supernova examined with X-rays for first time,en
WORLD,https://www.dailymail.co.uk/news/article-8618995/Chinese-coronavirus-worker-pours-buckets-sweat-hazmat-suit.html,dailymail.co.uk,2020-08-12 10:34:19,Chinese coronavirus worker pours out 'buckets of sweat' from her hazmat suit,en
SCIENCE,https://www.haveeru.com.mv/spacex-starship-prototype-can-take-big-move-towards-mars-with-very-first-very-small-hop/,haveeru.com.mv,2020-08-05 04:24:07,SpaceX Starship prototype can take big move towards Mars with very first very small 'hop',en
HEALTH,https://www.news-medical.net/news/20200805/Discovery-of-enzyme-could-provide-new-route-for-treating-Huntingtons-disease.aspx,news-medical.net,2020-08-05 16:53:00,Discovery of enzyme could provide new route for treating Huntington's disease,en
ENTERTAINMENT,https://www.cinemablend.com/news/2551373/every-kevin-smith-movie-ranked,cinemablend.com,2020-08-04 12:00:00,"Every Kevin Smith Movie, Ranked",en
WORLD,https://globalnews.ca/news/7247441/coronavirus-outbreak-norway-cruise-ship/,globalnews.ca,2020-08-03 13:51:42,"Coronavirus hits Norway cruise ship, officials fear spread across coastal villages",en
ENTERTAINMENT,https://www.cinemablend.com/television/2552403/the-big-bang-theorys-jim-parsons-explains-why-it-was-time-for-him-to-leave-the-show,cinemablend.com,2020-08-13 04:19:00,The Big Bang Theory's Jim Parsons Explains Why It Was Time For Him To Leave The Show,en
SPORTS,https://www.stabroeknews.com/2020/08/07/sports/miller-takes-aim-at-another-cpl-title-with-trinbago-knight-riders/,stabroeknews.com,2020-08-07 06:03:00,Miller takes aim at another CPL title with Trinbago Knight Riders,en
HEALTH,https://www.malaymail.com/news/singapore/2020/08/06/ntu-singapores-new-superbug-killer-offers-new-hope-in-fight-against-antibio/1891630,malaymail.com,2020-08-06 12:51:04,NTU Singapore’s new ‘superbug killer’ offers new hope in fight against antibiotic resistance crisis,en
ENTERTAINMENT,https://www.usatoday.com/story/news/2020/08/11/jeffrey-epstein-friend-ghislaine-maxwell-alleges-improper-jail-treatment/3346867001/,usatoday.com,2020-08-11 21:07:15,Jeffrey Epstein associate Ghislaine Maxwell complains about 'onerous' jail conditions,en
TECHNOLOGY,https://www.insidehook.com/article/audio/apple-airpods-wireless-charging-case-lowest-price,insidehook.com,2020-08-04 14:45:10,Deal: The Apple Watch and AirPods Are Near Their Lowest Prices Ever,en
TECHNOLOGY,https://www.asiaone.com/business/mediatek-introduces-newest-5g-soc-dimensity-800u-ultra-connectivity-and-advanced-5g-dual,asiaone.com,2020-08-18 01:00:00,"MediaTek Introduces Newest 5G SoC, Dimensity 800U for Ultra Connectivity and Advanced 5G Dual SIM Technology",en
BUSINESS,https://www.news18.com/news/auto/upcoming-all-new-audi-rs-q8-suv-bookings-open-in-india-for-rs-15-lakh-2763673.html,news18.com,2020-08-06 10:44:45,Upcoming All-New Audi RS Q8 SUV Bookings Open in India for Rs 15 Lakh,en
BUSINESS,https://www.fool.com/earnings/call-transcripts/2020/08/05/national-research-corporation-nrc-q2-2020-earnings.aspx,fool.com,2020-08-05 22:30:49,National Research Corporation (NRC) Q2 2020 Earnings Call Transcript,en
BUSINESS,https://www.aeresearch.net/insurance-brokers-and-agents-market-275740,aeresearch.net,2020-08-17 01:00:05,"Insurance Brokers And Agents Market Report 2020 Global Industry Size, Segment b",en
WORLD,https://www.japantimes.co.jp/news/2020/08/17/world/politics-diplomacy-world/us-china-ties-2020-election/,japantimes.co.jp,2020-08-17 11:09:00,Fraying U.S.-China relations tested by Trump ahead of election,en
SPORTS,https://nhl.nbcsports.com/2020/08/06/golden-knights-rally-again-to-beat-blues-will-play-for-top-seed/,nhl.nbcsports.com,2020-08-07 01:42:00,"Golden Knights rally again to beat Blues, will play for top seed",en
ENTERTAINMENT,https://www.ghgossip.com/bbnaija-apparently-ozo-kaisha-kiddwaya-others-voted-for-lilo-and-ka3na-to-be-evicted/,ghgossip.com,2020-08-03 14:34:00,"BBNaija: Apparently Ozo, Kaisha, Kiddwaya, Others Voted For Lilo And Ka3na To Be Evicted",en
NATION,https://sg.news.yahoo.com/ndp-fireworks-launched-at-10-islandwide-locations-for-sporeans-to-enjoy-from-home-012944489.html,sg.news.yahoo.com,2020-08-07 01:31:58,NDP fireworks to launch at 10 islandwide locations for S'poreans to enjoy from home,en
NATION,https://nypost.com/2020/08/08/trump-has-heated-phone-call-gop-mega-donor-sheldon-adelson-report/,nypost.com,2020-08-08 17:42:00,Trump has heated phone call with GOP mega-donor Sheldon Adelson: report,en
BUSINESS,https://www.moneycontrol.com/news/india/new-drug-rlf-100-shows-dramatic-results-for-critical-covid-19-patients-5652591.html,moneycontrol.com,2020-08-06 02:54:00,New drug RLF-100 shows dramatic results for critical COVID-19 patients,en
ENTERTAINMENT,https://news.avclub.com/taylor-swift-asks-fans-to-bring-down-u-s-president-wit-1844743879,news.avclub.com,2020-08-16 22:36:00,"Taylor Swift asks fans to bring down U.S. president with controversial ""vote early"" message",en
BUSINESS,https://www.aeresearch.net/gamification-platform-market-269083,aeresearch.net,2020-08-10 10:03:30,"Gamification Platform Market 2020: Industry Size & Share, Business Strategies,",en
TECHNOLOGY,https://gadgets.ndtv.com/mobiles/news/redmi-9-prime-sale-india-today-price-rs-9999-amazon-mi-com-specifications-2279633,gadgets.ndtv.com,2020-08-17 02:07:55,"Redmi 9 Prime Next Sale in India on August 24 via Amazon, Mi.com: Price, Sale Offers, More",en
TECHNOLOGY,https://za.ign.com/fall-guys/145945/feature/every-fall-guys-minigame-ranked,za.ign.com,2020-08-08 17:25:24,"Every Fall Guys Minigame, Ranked",en
NATION,https://www.thecable.ng/breaking-fg-weighs-options-against-ghana-over-clampdown-on-nigerian-traders,thecable.ng,2020-08-17 19:40:00,BREAKING: FG weighs options against Ghana over clampdown on Nigerian traders,en
WORLD,https://www.cbc.ca/news/canada/british-columbia/missing-fishermen-washington-1.5682151,cbc.ca,2020-08-11 20:08:00,U.S. Coast Guard searching for 2 people after Canadian boat takes on water,en
HEALTH,https://www.oneindia.com/india/govt-panel-on-covid-19-vaccine-protocol-discusses-delivery-mechanism-3134043.html,oneindia.com,2020-08-12 16:23:00,Govt panel on Covid-19 vaccine protocol discusses delivery mechanism,en
SCIENCE,https://www.courthousenews.com/new-timeline-ancient-ice-sheet-collapse-raises-warning-climate-change/,courthousenews.com,2017-11-09 21:04:15,New Timeline of Ancient Ice Sheet Collapse Raises Warning About Climate Change,en
NATION,https://www.dailymail.co.uk/news/article-8608571/Man-40-seriously-injured-second-man-arrested-crossbow-attack-Sydneys-south-west.html,dailymail.co.uk,2020-08-09 03:47:17,"Man, 40, seriously injured and second man arrested after crossbow attack in Sydney's south-west",en
BUSINESS,https://timesofindia.indiatimes.com/business/india-business/mm-reviews-all-subsidiaries-for-biz-returns/articleshow/77428431.cms,timesofindia.indiatimes.com,2020-08-08 06:44:00,M&M reviews all subsidiaries for biz returns,en
HEALTH,https://www.mindbodygreen.com/articles/hiit-exercises-benefit-down-syndrome-study,mindbodygreen.com,2020-08-04 23:25:02,Study Finds This Type Of Workout Is Best For People With Down Syndrome,en
HEALTH,https://primefeed.in/market-reports/4376636/amyotrophic-lateral-sclerosis-treatment-market-new-investment-growth-opportunities-by-2027/,primefeed.in,2020-08-14 14:57:00,Amyotrophic Lateral Sclerosis Treatment Market New Investment Growth Opportunities by 2027,en
HEALTH,https://www.reuters.com/article/health-health-coronavirus-germany-vaccin/german-institute-says-covid-19-vaccine-could-be-available-in-autumn-idUSL8N2FE4VT,reuters.com,2020-08-12 14:24:00,German institute says COVID-19 vaccine could be available in autumn,en
BUSINESS,https://www.fool.com/investing/2020/08/17/why-kodak-stock-plunged-today/,fool.com,2020-08-17 21:21:00,Why Kodak Stock Plunged Today,en
ENTERTAINMENT,https://www.polygon.com/2020/8/10/21362452/what-to-watch-on-netflix-hulu-hbo-max-amazon-shudder-indian-matchmaking-host-total-recall,polygon.com,2020-08-10 23:27:26,Netflix’s Indian Matchmaking offers a skewed view of Indian culture,en
HEALTH,https://www.bloombergquint.com/gadfly/revisiting-how-covid-19-ranks-with-seasonal-flu-and-1918-pandemic,bloombergquint.com,2020-08-06 15:04:28,The Great Covid-19 Versus Flu Comparison Revisited,en
SPORTS,https://wwos.nine.com.au/cricket/alyssa-healy-ash-gardner-asics-launch-womens-cricket-shoe/2f6d3e39-2dbb-495e-88f9-9417f26e52af,wwos.nine.com.au,2020-08-04 22:48:13,EXCLUSIVE: The sad reason Aussie hero Alyssa Healy never owned cricket shoes,en
SPORTS,https://metro.co.uk/2020/08/14/arsenal-conduct-internal-review-amid-concern-overpaid-nicolas-pepe-13127492/,metro.co.uk,2020-08-14 08:35:00,Arsenal bosses fear they made big error over Nicolas Pepe transfer,en
WORLD,https://www.irishmirror.ie/showbiz/celebrity-news/khloe-atkinson-death-formulaone-gridgirl-22495410,irishmirror.ie,2020-08-10 07:40:00,"Formula One grid girl, 33, who was in desperate need of kidney transplant dies",en
BUSINESS,https://www.dailymail.co.uk/sciencetech/article-8634765/Milk-cows-fed-grass-BETTER-environment-drinking-soya-milk-study-claims.html,dailymail.co.uk,2020-08-17 08:50:41,Milk from grass-fed cows 'more environmental than soya milk',en
WORLD,https://www.volcanodiscovery.com/earthquakes/quake-info/2922599/M4-Tue-11-Aug-10-Km-al-sur-de-Cartago-Costa-Rica.html,volcanodiscovery.com,2020-08-11 01:17:02,"Earthquake info : M4.2 earthquake on Tuesday, 11 August 2020 01:06 UTC / 8 Km al suroeste de Cartago, Costa Rica - 22 experience reports",en
TECHNOLOGY,http://global.chinadaily.com.cn/a/202008/12/WS5f339f44a31083481725fe00.html,global.chinadaily.com.cn,2020-08-12 09:45:18,Xiaomi's smart factory in Beijing starts operations,en
NATION,https://www.dawn.com/news/1572947/one-dead-another-injured-as-latest-spell-of-rain-lashes-parts-of-karachi,dawn.com,2020-08-06 18:00:00,"One dead, another injured as latest spell of rain lashes parts of Karachi",en
BUSINESS,https://finance.yahoo.com/news/top-u-mall-operator-simon-051858877.html,finance.yahoo.com,2020-08-10 12:37:00,The No. 1 U.S. mall operator faces a huge battle as retail tenants fight for their lives,en
TECHNOLOGY,https://www.abc.net.au/radio/melbourne/programs/breakfast/dr-norman-swan/12540334,abc.net.au,2020-08-09 19:30:00,Has Melbourne's COVID-19 trend finally turned the corner?,en
TECHNOLOGY,https://arstechnica.com/features/2020/08/work-from-home-01-ergo/,arstechnica.com,2020-08-07 13:00:00,Lawn chairs and kitchen tables: Ergonomics in the involuntary work-from-home era,en
TECHNOLOGY,https://www.standardmedia.co.ke/sci-tech/article/2001382224/smartphone-shipments-in-china-plunge-35-per-cent-in-july,standardmedia.co.ke,2020-08-12 08:46:09,Smartphone shipments in China plunge 35 per cent in July: government data,en
SPORTS,https://www.news24.com/sport/cricket/proteas/new-super-league-threatens-to-render-proteas-pre-covid-upswing-a-false-dawn-20200804,news24.com,2020-08-04 12:07:11,New Super League threatens to render Proteas' pre-Covid upswing a false dawn,en
WORLD,https://ewn.co.za/2020/08/06/trump-vows-executive-actions-on-emergency-coronavirus-relief,ewn.co.za,2020-08-06 18:27:10,Trump vows executive actions on emergency coronavirus relief,en
TECHNOLOGY,https://www.digitaltrends.com/dtdeals/asus-rog-zephyrus-g14-deal-best-buy-summer-sale-2020/,digitaltrends.com,2020-08-10 16:15:00,Cheap Gaming Laptop: Save $150 on the Asus ROG Zephyrus G14,en
TECHNOLOGY,https://www.nintendolife.com/news/animal-crossing-new-horizons-celeste-times-and-zodiac-furniture-recipes-complete-list,nintendolife.com,2020-08-17 05:27:00,Animal Crossing: New Horizons: Celeste Times & Zodiac Furniture Recipes Complete List,en
ENTERTAINMENT,https://www.forbes.com/sites/elanagross/2020/08/06/three-bon-appetit-stars-quit-videos-over-racial-discrimination/,forbes.com,2020-08-06 17:04:00,Three Bon Appetit Stars Will Stop Filming Videos Over Racial Discrimination,en
ENTERTAINMENT,https://www.heraldsun.com.au/subscribe/news/1/?sourceCode=HSWEB_WRE170_a&dest=https%3A%2F%2Fwww.heraldsun.com.au%2Fnews%2Fworld%2Fjeffrey-epstein-accuser-claims-prince-andrew-has-crucial-information-on-billionaire-paedophiles-associates%2Fnews-story%2F2401f44c4454e135867ebe79e80446a5&memtype=anonymous&mode=premium&nk=6210898cb082a771059f8ab42b3ca977-1597439584,heraldsun.com.au,2020-08-14 19:55:04,"Ghislaine Maxwell at serious risk of being beaten or killed by fellow prisoners, prosecutors reveal",en
BUSINESS,https://economictimes.indiatimes.com/industry/telecom/telecom-news/the-low-profile-delhi-firm-behind-the-rs-16000-crore-bid-for-anil-ambanis-telecom-assets/articleshow/77348355.cms,economictimes.indiatimes.com,2020-08-04 09:48:00,"The low-profile Delhi firm behind the Rs 16,000-crore bid for Anil Ambani's telecom assets",en
TECHNOLOGY,https://www.techradar.com/news/24-hours-with-the-canon-eos-r5-a-wildlife-photographer-gives-his-verdict,techradar.com,2020-08-18 05:00:00,24 hours with the Canon EOS R5: a wildlife photographer gives his verdict,en
TECHNOLOGY,https://eandt.theiet.org/content/articles/2020/08/whatsapp-integrates-fact-checking-option-for-forwarded-messages/,eandt.theiet.org,2020-08-04 15:02:21,WhatsApp integrates fact-checking option for forwarded messages,en
BUSINESS,https://in.reuters.com/article/global-precious/gold-ticks-higher-on-softer-dollar-china-data-in-focus-idINKCN25A05N,in.reuters.com,2020-08-14 01:45:00,Gold ticks higher on softer dollar; China data in focus,en
ENTERTAINMENT,https://www.malaymail.com/news/life/2020/08/04/us-tiktok-star-addison-rae-is-launching-a-cosmetics-line/1890769,malaymail.com,2020-08-04 00:10:54,US TikTok star Addison Rae is launching a cosmetics line,en
WORLD,https://www.news.com.au/world/coronavirus/new-zealand-lockdown-stage-3-restrictions-after-new-coronavirus-cases/news-story/eb9499c5e611a8a414bc5c9f986577e2,news.com.au,2020-08-12 00:26:38,New Zealand lockdown: Stage 3 restrictions after new coronavirus cases,en
SCIENCE,https://www.nasa.gov/press-release/nasa-administrator-statement-on-the-passing-of-mike-freilich/,nasa.gov,2020-08-05 15:47:11,NASA Administrator Statement on the Passing of Mike Freilich,en
ENTERTAINMENT,https://www.soompi.com/article/1418963wpp/watch-performances-from-2020-soribada-best-k-music-awards,soompi.com,2020-08-13 17:08:10,Watch: Performances From 2020 Soribada Best K-Music Awards,en
SCIENCE,https://www.abc27.com/news/nasa-confirms-spacex-crew-dragon-will-splashdown-in-pensacola-2/,abc27.com,2020-08-02 15:06:00,NASA confirms SpaceX Crew Dragon will splashdown near Pensacola,en
HEALTH,https://edition.cnn.com/2020/08/05/us/mask-safety-google-doodle-trnd/index.html,edition.cnn.com,2020-08-05 11:09:16,Google Doodle promotes mask wearing and social distancing practices,en
TECHNOLOGY,https://www.techradar.com/news/dell-xps-deals-have-hit-dollar699-this-weekend-sales-cheap-price,techradar.com,2020-08-08 18:45:00,Dell XPS 13 deals have hit $699 this weekend,en
SPORTS,https://www.espn.com.au/nba/story/_/id/29629978/joel-embiid-injures-ankle-vs-blazers-ruled-return,espn.com.au,2020-08-10 00:07:41,Joel Embiid injures ankle in first quarter vs. Blazers; status uncertain,en
NATION,https://www.gmanetwork.com/news/news/nation/750137/dominguez-no-budget-for-cash-aid-in-unforeseen-revert-to-mecq/story/,gmanetwork.com,2020-08-06 08:33:00,Dominguez: No budget for cash aid in unforeseen revert to MECQ,en
TECHNOLOGY,https://www.yahoo.com/lifestyle/musician-raising-money-pay-mom-180056751.html,yahoo.com,2020-08-10 18:00:00,Man raising money to pay mom's rent left speechless by stranger outside Target: 'Excuse me?',en
TECHNOLOGY,https://www.androidcentral.com/microsoft-your-phone-will-soon-let-you-run-android-apps-windows-windows-10,androidcentral.com,2020-08-05 15:01:42,Microsoft 'Your Phone' will soon let you stream your Android apps to Windows 10,en
TECHNOLOGY,https://www.goodhousekeeping.com/uk/fashion-beauty/a33603069/ghd-rise-brush-review/,goodhousekeeping.com,2020-08-17 14:43:00,GHD’s new tool finally makes volumised hair an easy feat,en
HEALTH,"https://www.itwire.com/home-it/australian-it-professionals-ahead-of-global-counterparts-in-experiencing-disruptions,-outages-working-remotely.html",itwire.com,2020-08-14 00:58:44,"Australian IT professionals ahead of global counterparts in experiencing disruptions, outages working remotely",en
WORLD,https://www.ctvnews.ca/world/survivors-of-deadly-india-crash-say-plane-swayed-violently-1.5056411,ctvnews.ca,2020-08-08 11:39:00,Survivors of deadly India crash say plane swayed violently,en
BUSINESS,https://au.finance.yahoo.com/news/westpac-issues-covid-19-scam-alert-023010419.html,au.finance.yahoo.com,2020-08-10 02:35:08,‘Remain vigilant’: Westpac warns of scam spike,en
TECHNOLOGY,https://www.newstalk.com/news/schools-return-masks-breaks-1059920,newstalk.com,2020-08-12 17:35:48,Schools consider 'breathing breaks' to allow students time without masks,en
HEALTH,https://www.theguardian.pe.ca/news/world/china-sinopharms-potential-covid-19-vaccine-triggers-antibodies-in-clinical-trials-journal-485131/,theguardian.pe.ca,2020-08-14 06:47:25,China Sinopharm's potential COVID-19 vaccine triggers antibodies in clinical trials: journal,en
NATION,https://www.manilatimes.net/2020/08/10/news/latest-stories/political-dynasties-the-real-oligarchs-ateneo-dean/753443/,manilatimes.net,2020-08-10 07:00:31,Political Dynasties The Real Oligarchs -- Ateneo Dean – The Manila Times,en
